song,album,prev,lyric,next,artist
Sad Waters,Your Funeral… My Trial,,Down the road I look and there runs Mary,Hair of gold and lips like cherries,Nick Cave & The Bad Seeds
Sad Waters,Your Funeral… My Trial,Down the road I look and there runs Mary,Hair of gold and lips like cherries,We go down to the river where the willows weep,Nick Cave & The Bad Seeds
Sad Waters,Your Funeral… My Trial,Hair of gold and lips like cherries,We go down to the river where the willows weep,Take a naked root for a lover’s seat,Nick Cave & The Bad Seeds
Sad Waters,Your Funeral… My Trial,We go down to the river where the willows weep,Take a naked root for a lover’s seat,That rose out of the bitten soil,Nick Cave & The Bad Seeds
Sad Waters,Your Funeral… My Trial,Take a naked root for a lover’s seat,That rose out of the bitten soil,But bound to the ground by creeping ivy coils,Nick Cave & The Bad Seeds
Sad Waters,Your Funeral… My Trial,That rose out of the bitten soil,But bound to the ground by creeping ivy coils,O Mary you have seduced my soul,Nick Cave & The Bad Seeds
Sad Waters,Your Funeral… My Trial,But bound to the ground by creeping ivy coils,O Mary you have seduced my soul,(And I don’t know right from wrong),Nick Cave & The Bad Seeds
Sad Waters,Your Funeral… My Trial,O Mary you have seduced my soul,(And I don’t know right from wrong),Forever a hostage of your child’s world,Nick Cave & The Bad Seeds
Sad Waters,Your Funeral… My Trial,(And I don’t know right from wrong),Forever a hostage of your child’s world,,Nick Cave & The Bad Seeds
Sad Waters,Your Funeral… My Trial,Forever a hostage of your child’s world,,And then I ran my tin-cup heart along,Nick Cave & The Bad Seeds
Sad Waters,Your Funeral… My Trial,,And then I ran my tin-cup heart along,The prison of her ribs,Nick Cave & The Bad Seeds
Sad Waters,Your Funeral… My Trial,And then I ran my tin-cup heart along,The prison of her ribs,And with a toss of her curls,Nick Cave & The Bad Seeds
Sad Waters,Your Funeral… My Trial,The prison of her ribs,And with a toss of her curls,That little girl goes wading in,Nick Cave & The Bad Seeds
Sad Waters,Your Funeral… My Trial,And with a toss of her curls,That little girl goes wading in,Rollin her dress up past her knee,Nick Cave & The Bad Seeds
Sad Waters,Your Funeral… My Trial,That little girl goes wading in,Rollin her dress up past her knee,Turning these waters into wine,Nick Cave & The Bad Seeds
Sad Waters,Your Funeral… My Trial,Rollin her dress up past her knee,Turning these waters into wine,Then she platted all the willow vines,Nick Cave & The Bad Seeds
Sad Waters,Your Funeral… My Trial,Turning these waters into wine,Then she platted all the willow vines,,Nick Cave & The Bad Seeds
Sad Waters,Your Funeral… My Trial,Then she platted all the willow vines,,Mary in the shallows laughing,Nick Cave & The Bad Seeds
Sad Waters,Your Funeral… My Trial,,Mary in the shallows laughing,Over where the carp dart,Nick Cave & The Bad Seeds
Sad Waters,Your Funeral… My Trial,Mary in the shallows laughing,Over where the carp dart,Spooked by the new shadows that she cast,Nick Cave & The Bad Seeds
Sad Waters,Your Funeral… My Trial,Over where the carp dart,Spooked by the new shadows that she cast,Across these sad waters and across my heart,Nick Cave & The Bad Seeds
Sad Waters,Your Funeral… My Trial,Spooked by the new shadows that she cast,Across these sad waters and across my heart,,Nick Cave & The Bad Seeds
The Carny,Your Funeral… My Trial,,And no-one saw the carny go,And the weeks flew by,Nick Cave & The Bad Seeds
The Carny,Your Funeral… My Trial,And no-one saw the carny go,And the weeks flew by,Until they moved on the show,Nick Cave & The Bad Seeds
The Carny,Your Funeral… My Trial,And the weeks flew by,Until they moved on the show,Leaving his caravan behind,Nick Cave & The Bad Seeds
The Carny,Your Funeral… My Trial,Until they moved on the show,Leaving his caravan behind,It was parked out on the south east ridge,Nick Cave & The Bad Seeds
The Carny,Your Funeral… My Trial,Leaving his caravan behind,It was parked out on the south east ridge,And as the company crossed the bridge,Nick Cave & The Bad Seeds
The Carny,Your Funeral… My Trial,It was parked out on the south east ridge,And as the company crossed the bridge,With the first rain filling the bone-dry river bed,Nick Cave & The Bad Seeds
The Carny,Your Funeral… My Trial,And as the company crossed the bridge,With the first rain filling the bone-dry river bed,"It shone, just so, upon the edge",Nick Cave & The Bad Seeds
The Carny,Your Funeral… My Trial,With the first rain filling the bone-dry river bed,"It shone, just so, upon the edge","Away, away, we’re sad, they said",Nick Cave & The Bad Seeds
The Carny,Your Funeral… My Trial,"It shone, just so, upon the edge","Away, away, we’re sad, they said",,Nick Cave & The Bad Seeds
The Carny,Your Funeral… My Trial,"Away, away, we’re sad, they said",,"Dog-boy, atlas, half-man, the geeks, the hired hands",Nick Cave & The Bad Seeds
The Carny,Your Funeral… My Trial,,"Dog-boy, atlas, half-man, the geeks, the hired hands",There was not one among them that did not cast an eye behind,Nick Cave & The Bad Seeds
The Carny,Your Funeral… My Trial,"Dog-boy, atlas, half-man, the geeks, the hired hands",There was not one among them that did not cast an eye behind,In the hope that the carny would return to his own kind,Nick Cave & The Bad Seeds
The Carny,Your Funeral… My Trial,There was not one among them that did not cast an eye behind,In the hope that the carny would return to his own kind,"And the carny had a horse, all skin and bone",Nick Cave & The Bad Seeds
The Carny,Your Funeral… My Trial,In the hope that the carny would return to his own kind,"And the carny had a horse, all skin and bone","A bow-backed nag, that he named “Sorrow”",Nick Cave & The Bad Seeds
The Carny,Your Funeral… My Trial,"And the carny had a horse, all skin and bone","A bow-backed nag, that he named “Sorrow”",Now it is buried in a shallow grave,Nick Cave & The Bad Seeds
The Carny,Your Funeral… My Trial,"A bow-backed nag, that he named “Sorrow”",Now it is buried in a shallow grave,In the then parched meadow,Nick Cave & The Bad Seeds
The Carny,Your Funeral… My Trial,Now it is buried in a shallow grave,In the then parched meadow,,Nick Cave & The Bad Seeds
The Carny,Your Funeral… My Trial,In the then parched meadow,,And the dwarves were given the task of digging the ditch,Nick Cave & The Bad Seeds
The Carny,Your Funeral… My Trial,,And the dwarves were given the task of digging the ditch,And laying the nag’s carcass in the ground,Nick Cave & The Bad Seeds
The Carny,Your Funeral… My Trial,And the dwarves were given the task of digging the ditch,And laying the nag’s carcass in the ground,"And boss Bellini, waving his smoking pistol around",Nick Cave & The Bad Seeds
The Carny,Your Funeral… My Trial,And laying the nag’s carcass in the ground,"And boss Bellini, waving his smoking pistol around","Saying, “The nag is dead meat”",Nick Cave & The Bad Seeds
The Carny,Your Funeral… My Trial,"And boss Bellini, waving his smoking pistol around","Saying, “The nag is dead meat”",“We can’t afford to carry dead weight”,Nick Cave & The Bad Seeds
The Carny,Your Funeral… My Trial,"Saying, “The nag is dead meat”",“We can’t afford to carry dead weight”,The whole company standing about,Nick Cave & The Bad Seeds
The Carny,Your Funeral… My Trial,“We can’t afford to carry dead weight”,The whole company standing about,Not making a sound,Nick Cave & The Bad Seeds
The Carny,Your Funeral… My Trial,The whole company standing about,Not making a sound,And turning to dwarves perched on the enclosure gate,Nick Cave & The Bad Seeds
The Carny,Your Funeral… My Trial,Not making a sound,And turning to dwarves perched on the enclosure gate,The boss says “Bury this lump of crow bait”,Nick Cave & The Bad Seeds
The Carny,Your Funeral… My Trial,And turning to dwarves perched on the enclosure gate,The boss says “Bury this lump of crow bait”,,Nick Cave & The Bad Seeds
The Carny,Your Funeral… My Trial,The boss says “Bury this lump of crow bait”,,And then the rain came hammering down,Nick Cave & The Bad Seeds
The Carny,Your Funeral… My Trial,,And then the rain came hammering down,Everybody running for their wagons,Nick Cave & The Bad Seeds
The Carny,Your Funeral… My Trial,And then the rain came hammering down,Everybody running for their wagons,Tying all the canvas flaps down,Nick Cave & The Bad Seeds
The Carny,Your Funeral… My Trial,Everybody running for their wagons,Tying all the canvas flaps down,The mangy cats growling in their cages,Nick Cave & The Bad Seeds
The Carny,Your Funeral… My Trial,Tying all the canvas flaps down,The mangy cats growling in their cages,The bird-girl flapping and squawking around,Nick Cave & The Bad Seeds
The Carny,Your Funeral… My Trial,The mangy cats growling in their cages,The bird-girl flapping and squawking around,The whole valley reeking of wet beast,Nick Cave & The Bad Seeds
The Carny,Your Funeral… My Trial,The bird-girl flapping and squawking around,The whole valley reeking of wet beast,Wet beast and rotten hay,Nick Cave & The Bad Seeds
The Carny,Your Funeral… My Trial,The whole valley reeking of wet beast,Wet beast and rotten hay,Freak and brute creation,Nick Cave & The Bad Seeds
The Carny,Your Funeral… My Trial,Wet beast and rotten hay,Freak and brute creation,Packed up and on their way,Nick Cave & The Bad Seeds
The Carny,Your Funeral… My Trial,Freak and brute creation,Packed up and on their way,,Nick Cave & The Bad Seeds
The Carny,Your Funeral… My Trial,Packed up and on their way,,The three dwarves peering from their wagon’s hind,Nick Cave & The Bad Seeds
The Carny,Your Funeral… My Trial,,The three dwarves peering from their wagon’s hind,Moses says to Noah “We shoulda dugga deepa one”,Nick Cave & The Bad Seeds
The Carny,Your Funeral… My Trial,The three dwarves peering from their wagon’s hind,Moses says to Noah “We shoulda dugga deepa one”,Their grizzled faces like dying moons,Nick Cave & The Bad Seeds
The Carny,Your Funeral… My Trial,Moses says to Noah “We shoulda dugga deepa one”,Their grizzled faces like dying moons,Still dirty from the digging done,Nick Cave & The Bad Seeds
The Carny,Your Funeral… My Trial,Their grizzled faces like dying moons,Still dirty from the digging done,"And Charlie, the eldest of the three, said",Nick Cave & The Bad Seeds
The Carny,Your Funeral… My Trial,Still dirty from the digging done,"And Charlie, the eldest of the three, said",“I guess the carny ain’t gonna show”,Nick Cave & The Bad Seeds
The Carny,Your Funeral… My Trial,"And Charlie, the eldest of the three, said",“I guess the carny ain’t gonna show”,And they were silent for a spell,Nick Cave & The Bad Seeds
The Carny,Your Funeral… My Trial,“I guess the carny ain’t gonna show”,And they were silent for a spell,Wishing they’d done a better job of burying Sorrow,Nick Cave & The Bad Seeds
The Carny,Your Funeral… My Trial,And they were silent for a spell,Wishing they’d done a better job of burying Sorrow,,Nick Cave & The Bad Seeds
The Carny,Your Funeral… My Trial,Wishing they’d done a better job of burying Sorrow,,And as the company passed from the valley,Nick Cave & The Bad Seeds
The Carny,Your Funeral… My Trial,,And as the company passed from the valley,Into higher ground,Nick Cave & The Bad Seeds
The Carny,Your Funeral… My Trial,And as the company passed from the valley,Into higher ground,The rain beat on the ridge and on the meadow,Nick Cave & The Bad Seeds
The Carny,Your Funeral… My Trial,Into higher ground,The rain beat on the ridge and on the meadow,And on the mound,Nick Cave & The Bad Seeds
The Carny,Your Funeral… My Trial,The rain beat on the ridge and on the meadow,And on the mound,"Until nothing was left, nothing at all",Nick Cave & The Bad Seeds
The Carny,Your Funeral… My Trial,And on the mound,"Until nothing was left, nothing at all",Except the body of Sorrow,Nick Cave & The Bad Seeds
The Carny,Your Funeral… My Trial,"Until nothing was left, nothing at all",Except the body of Sorrow,That rose in time,Nick Cave & The Bad Seeds
The Carny,Your Funeral… My Trial,Except the body of Sorrow,That rose in time,To float upon the surface of the eaten soil,Nick Cave & The Bad Seeds
The Carny,Your Funeral… My Trial,That rose in time,To float upon the surface of the eaten soil,,Nick Cave & The Bad Seeds
The Carny,Your Funeral… My Trial,To float upon the surface of the eaten soil,,And a murder of crows did circle round,Nick Cave & The Bad Seeds
The Carny,Your Funeral… My Trial,,And a murder of crows did circle round,"First one, then the others flapping blackly down",Nick Cave & The Bad Seeds
The Carny,Your Funeral… My Trial,And a murder of crows did circle round,"First one, then the others flapping blackly down",And the carny’s van still sat upon the edge,Nick Cave & The Bad Seeds
The Carny,Your Funeral… My Trial,"First one, then the others flapping blackly down",And the carny’s van still sat upon the edge,Tilting slowly as the firm ground turned to sludge,Nick Cave & The Bad Seeds
The Carny,Your Funeral… My Trial,And the carny’s van still sat upon the edge,Tilting slowly as the firm ground turned to sludge,And the rain it hammered down,Nick Cave & The Bad Seeds
The Carny,Your Funeral… My Trial,Tilting slowly as the firm ground turned to sludge,And the rain it hammered down,And no-one saw the carny go I say it’s funny how things go,Nick Cave & The Bad Seeds
The Carny,Your Funeral… My Trial,And the rain it hammered down,And no-one saw the carny go I say it’s funny how things go,,Nick Cave & The Bad Seeds
Your Funeral… My Trial,Your Funeral… My Trial,,I am a crooked man,And I’ve walked a crooked mile,Nick Cave & The Bad Seeds
Your Funeral… My Trial,Your Funeral… My Trial,I am a crooked man,And I’ve walked a crooked mile,"Night, the shameless widow",Nick Cave & The Bad Seeds
Your Funeral… My Trial,Your Funeral… My Trial,And I’ve walked a crooked mile,"Night, the shameless widow","Doffed her weeds, in a pile",Nick Cave & The Bad Seeds
Your Funeral… My Trial,Your Funeral… My Trial,"Night, the shameless widow","Doffed her weeds, in a pile",The stars all winked at me,Nick Cave & The Bad Seeds
Your Funeral… My Trial,Your Funeral… My Trial,"Doffed her weeds, in a pile",The stars all winked at me,They shamed a child,Nick Cave & The Bad Seeds
Your Funeral… My Trial,Your Funeral… My Trial,The stars all winked at me,They shamed a child,"Your funeral, my trial",Nick Cave & The Bad Seeds
Your Funeral… My Trial,Your Funeral… My Trial,They shamed a child,"Your funeral, my trial",,Nick Cave & The Bad Seeds
Your Funeral… My Trial,Your Funeral… My Trial,"Your funeral, my trial",,A thousand Marys lured me,Nick Cave & The Bad Seeds
Your Funeral… My Trial,Your Funeral… My Trial,,A thousand Marys lured me,To feathered beds and fields of clover,Nick Cave & The Bad Seeds
Your Funeral… My Trial,Your Funeral… My Trial,A thousand Marys lured me,To feathered beds and fields of clover,Bird with crooked wing cast,Nick Cave & The Bad Seeds
Your Funeral… My Trial,Your Funeral… My Trial,To feathered beds and fields of clover,Bird with crooked wing cast,It’s wicked shadow over,Nick Cave & The Bad Seeds
Your Funeral… My Trial,Your Funeral… My Trial,Bird with crooked wing cast,It’s wicked shadow over,A bauble moon did mock,Nick Cave & The Bad Seeds
Your Funeral… My Trial,Your Funeral… My Trial,It’s wicked shadow over,A bauble moon did mock,And trinket stars did smile,Nick Cave & The Bad Seeds
Your Funeral… My Trial,Your Funeral… My Trial,A bauble moon did mock,And trinket stars did smile,"Your funeral, my trial",Nick Cave & The Bad Seeds
Your Funeral… My Trial,Your Funeral… My Trial,And trinket stars did smile,"Your funeral, my trial",,Nick Cave & The Bad Seeds
Your Funeral… My Trial,Your Funeral… My Trial,"Your funeral, my trial",,"Here I am, little lamb",Nick Cave & The Bad Seeds
Your Funeral… My Trial,Your Funeral… My Trial,,"Here I am, little lamb",Let all the bells in whoredom ring,Nick Cave & The Bad Seeds
Your Funeral… My Trial,Your Funeral… My Trial,"Here I am, little lamb",Let all the bells in whoredom ring,All the crooked bitches that she was,Nick Cave & The Bad Seeds
Your Funeral… My Trial,Your Funeral… My Trial,Let all the bells in whoredom ring,All the crooked bitches that she was,(Mongers of pain),Nick Cave & The Bad Seeds
Your Funeral… My Trial,Your Funeral… My Trial,All the crooked bitches that she was,(Mongers of pain),Saw the moon,Nick Cave & The Bad Seeds
Your Funeral… My Trial,Your Funeral… My Trial,(Mongers of pain),Saw the moon,Become a fang,Nick Cave & The Bad Seeds
Your Funeral… My Trial,Your Funeral… My Trial,Saw the moon,Become a fang,"Your funeral, my trial",Nick Cave & The Bad Seeds
Your Funeral… My Trial,Your Funeral… My Trial,Become a fang,"Your funeral, my trial",,Nick Cave & The Bad Seeds
Stranger Than Kindness,Your Funeral… My Trial,,Stranger than kindness,Bottled light from hotels,Nick Cave & The Bad Seeds
Stranger Than Kindness,Your Funeral… My Trial,Stranger than kindness,Bottled light from hotels,Spilling everything,Nick Cave & The Bad Seeds
Stranger Than Kindness,Your Funeral… My Trial,Bottled light from hotels,Spilling everything,Wet hand from the volcano,Nick Cave & The Bad Seeds
Stranger Than Kindness,Your Funeral… My Trial,Spilling everything,Wet hand from the volcano,Sobers your skin,Nick Cave & The Bad Seeds
Stranger Than Kindness,Your Funeral… My Trial,Wet hand from the volcano,Sobers your skin,Stranger than kindness,Nick Cave & The Bad Seeds
Stranger Than Kindness,Your Funeral… My Trial,Sobers your skin,Stranger than kindness,,Nick Cave & The Bad Seeds
Stranger Than Kindness,Your Funeral… My Trial,Stranger than kindness,,You caress yourself,Nick Cave & The Bad Seeds
Stranger Than Kindness,Your Funeral… My Trial,,You caress yourself,And grind my soft cold bones below,Nick Cave & The Bad Seeds
Stranger Than Kindness,Your Funeral… My Trial,You caress yourself,And grind my soft cold bones below,Your map of desire,Nick Cave & The Bad Seeds
Stranger Than Kindness,Your Funeral… My Trial,And grind my soft cold bones below,Your map of desire,Burned in your flesh,Nick Cave & The Bad Seeds
Stranger Than Kindness,Your Funeral… My Trial,Your map of desire,Burned in your flesh,Even a fool can come,Nick Cave & The Bad Seeds
Stranger Than Kindness,Your Funeral… My Trial,Burned in your flesh,Even a fool can come,A strange lit stair,Nick Cave & The Bad Seeds
Stranger Than Kindness,Your Funeral… My Trial,Even a fool can come,A strange lit stair,And find a rope hanging there,Nick Cave & The Bad Seeds
Stranger Than Kindness,Your Funeral… My Trial,A strange lit stair,And find a rope hanging there,Stranger than kindness,Nick Cave & The Bad Seeds
Stranger Than Kindness,Your Funeral… My Trial,And find a rope hanging there,Stranger than kindness,,Nick Cave & The Bad Seeds
Stranger Than Kindness,Your Funeral… My Trial,Stranger than kindness,,Keys rain like heaven’s hair,Nick Cave & The Bad Seeds
Stranger Than Kindness,Your Funeral… My Trial,,Keys rain like heaven’s hair,There is no home there is no bread,Nick Cave & The Bad Seeds
Stranger Than Kindness,Your Funeral… My Trial,Keys rain like heaven’s hair,There is no home there is no bread,We sit at the gate and scratch,Nick Cave & The Bad Seeds
Stranger Than Kindness,Your Funeral… My Trial,There is no home there is no bread,We sit at the gate and scratch,The gaunt fruit of passion,Nick Cave & The Bad Seeds
Stranger Than Kindness,Your Funeral… My Trial,We sit at the gate and scratch,The gaunt fruit of passion,Dies in the light,Nick Cave & The Bad Seeds
Stranger Than Kindness,Your Funeral… My Trial,The gaunt fruit of passion,Dies in the light,Stranger than kindness,Nick Cave & The Bad Seeds
Stranger Than Kindness,Your Funeral… My Trial,Dies in the light,Stranger than kindness,,Nick Cave & The Bad Seeds
Stranger Than Kindness,Your Funeral… My Trial,Stranger than kindness,,Your sleeping hands journey,Nick Cave & The Bad Seeds
Stranger Than Kindness,Your Funeral… My Trial,,Your sleeping hands journey,They loiter,Nick Cave & The Bad Seeds
Stranger Than Kindness,Your Funeral… My Trial,Your sleeping hands journey,They loiter,Stranger than kindness,Nick Cave & The Bad Seeds
Stranger Than Kindness,Your Funeral… My Trial,They loiter,Stranger than kindness,You hold me so carelessly close,Nick Cave & The Bad Seeds
Stranger Than Kindness,Your Funeral… My Trial,Stranger than kindness,You hold me so carelessly close,Tell me I’m dirty,Nick Cave & The Bad Seeds
Stranger Than Kindness,Your Funeral… My Trial,You hold me so carelessly close,Tell me I’m dirty,Stranger than kindness,Nick Cave & The Bad Seeds
Stranger Than Kindness,Your Funeral… My Trial,Tell me I’m dirty,Stranger than kindness,,Nick Cave & The Bad Seeds
Jack's Shadow,Your Funeral… My Trial,,They dragged Jack and his shadow,From the hole,Nick Cave & The Bad Seeds
Jack's Shadow,Your Funeral… My Trial,They dragged Jack and his shadow,From the hole,And the bulb that burned above him,Nick Cave & The Bad Seeds
Jack's Shadow,Your Funeral… My Trial,From the hole,And the bulb that burned above him,Did shine both day and night,Nick Cave & The Bad Seeds
Jack's Shadow,Your Funeral… My Trial,And the bulb that burned above him,Did shine both day and night,And his shadow learned to love his,Nick Cave & The Bad Seeds
Jack's Shadow,Your Funeral… My Trial,Did shine both day and night,And his shadow learned to love his,Little darks and greater light,Nick Cave & The Bad Seeds
Jack's Shadow,Your Funeral… My Trial,And his shadow learned to love his,Little darks and greater light,,Nick Cave & The Bad Seeds
Jack's Shadow,Your Funeral… My Trial,Little darks and greater light,,And the sun it shined,Nick Cave & The Bad Seeds
Jack's Shadow,Your Funeral… My Trial,,And the sun it shined,And the sun it shined,Nick Cave & The Bad Seeds
Jack's Shadow,Your Funeral… My Trial,And the sun it shined,And the sun it shined,And the sun it shined,Nick Cave & The Bad Seeds
Jack's Shadow,Your Funeral… My Trial,And the sun it shined,And the sun it shined,A little stronger,Nick Cave & The Bad Seeds
Jack's Shadow,Your Funeral… My Trial,And the sun it shined,A little stronger,,Nick Cave & The Bad Seeds
Jack's Shadow,Your Funeral… My Trial,A little stronger,,Jack wept and kissed his shadow “Goodbye”,Nick Cave & The Bad Seeds
Jack's Shadow,Your Funeral… My Trial,,Jack wept and kissed his shadow “Goodbye”,Spat from their dirty dungeons,Nick Cave & The Bad Seeds
Jack's Shadow,Your Funeral… My Trial,Jack wept and kissed his shadow “Goodbye”,Spat from their dirty dungeons,Into a truly different din,Nick Cave & The Bad Seeds
Jack's Shadow,Your Funeral… My Trial,Spat from their dirty dungeons,Into a truly different din,Shat from their institutions,Nick Cave & The Bad Seeds
Jack's Shadow,Your Funeral… My Trial,Into a truly different din,Shat from their institutions,Into a fully different din,Nick Cave & The Bad Seeds
Jack's Shadow,Your Funeral… My Trial,Shat from their institutions,Into a fully different din,And his shadow soon became a wife,Nick Cave & The Bad Seeds
Jack's Shadow,Your Funeral… My Trial,Into a fully different din,And his shadow soon became a wife,And children plagued his latter life,Nick Cave & The Bad Seeds
Jack's Shadow,Your Funeral… My Trial,And his shadow soon became a wife,And children plagued his latter life,Until one night he took a skinning knife,Nick Cave & The Bad Seeds
Jack's Shadow,Your Funeral… My Trial,And children plagued his latter life,Until one night he took a skinning knife,And stole into the town,Nick Cave & The Bad Seeds
Jack's Shadow,Your Funeral… My Trial,Until one night he took a skinning knife,And stole into the town,And tracked his shadow down,Nick Cave & The Bad Seeds
Jack's Shadow,Your Funeral… My Trial,And stole into the town,And tracked his shadow down,,Nick Cave & The Bad Seeds
Jack's Shadow,Your Funeral… My Trial,And tracked his shadow down,,Said the shadow to Jack Henry,Nick Cave & The Bad Seeds
Jack's Shadow,Your Funeral… My Trial,,Said the shadow to Jack Henry,“What’s wrong?”,Nick Cave & The Bad Seeds
Jack's Shadow,Your Funeral… My Trial,Said the shadow to Jack Henry,“What’s wrong?”,Jack said “A home is not a hole”,Nick Cave & The Bad Seeds
Jack's Shadow,Your Funeral… My Trial,“What’s wrong?”,Jack said “A home is not a hole”,"“And Shadow, you’re just a gallow that I hang my body from”",Nick Cave & The Bad Seeds
Jack's Shadow,Your Funeral… My Trial,Jack said “A home is not a hole”,"“And Shadow, you’re just a gallow that I hang my body from”","“O Shadow, your a shackle from which my time is never done”",Nick Cave & The Bad Seeds
Jack's Shadow,Your Funeral… My Trial,"“And Shadow, you’re just a gallow that I hang my body from”","“O Shadow, your a shackle from which my time is never done”",Then he peeled his shadow off in strips,Nick Cave & The Bad Seeds
Jack's Shadow,Your Funeral… My Trial,"“O Shadow, your a shackle from which my time is never done”",Then he peeled his shadow off in strips,He peeled his shadow off in strips,Nick Cave & The Bad Seeds
Jack's Shadow,Your Funeral… My Trial,Then he peeled his shadow off in strips,He peeled his shadow off in strips,Then kneeled his shadow on some steps,Nick Cave & The Bad Seeds
